{
  "$schema": "https://json-schema.org/draft/2020-12/schema",
  "$id": "https://github.com/durable-workflow/.github/blob/main/product-train/sdk-server-qualification-schema.json",
  "title": "Durable Workflow SDK-to-Server qualification",
  "type": "object",
  "additionalProperties": false,
  "required": [
    "$schema",
    "schema",
    "release_plan",
    "outcome",
    "evidence",
    "bindings"
  ],
  "properties": {
    "$schema": {
      "const": "./sdk-server-qualification-schema.json"
    },
    "schema": {
      "const": "durable-workflow.sdk-server-qualification/v1"
    },
    "release_plan": {
      "type": "object",
      "additionalProperties": false,
      "required": ["tag", "sha256"],
      "properties": {
        "tag": {
          "type": "string",
          "pattern": "^release-plan/[a-z0-9][a-z0-9._-]{0,55}$"
        },
        "sha256": {
          "$ref": "#/$defs/sha256"
        }
      }
    },
    "outcome": {
      "enum": ["pass", "fail"]
    },
    "evidence": {
      "type": "object",
      "additionalProperties": false,
      "required": [
        "schema",
        "tag",
        "source_url",
        "sha256",
        "outcome",
        "github_run"
      ],
      "properties": {
        "schema": {
          "const": "durable-workflow.beta-conformance.suite-result/v2"
        },
        "tag": {
          "type": "string",
          "pattern": "^beta-conformance/(?:beta|rc)-[a-z0-9._-]+/[1-9][0-9]*\\.[1-9][0-9]*$"
        },
        "source_url": {
          "type": "string",
          "pattern": "^https://github\\.com/durable-workflow/\\.github/releases/download/beta-conformance/"
        },
        "sha256": {
          "$ref": "#/$defs/sha256"
        },
        "outcome": {
          "enum": ["pass", "fail"]
        },
        "github_run": {
          "$ref": "#/$defs/githubRun"
        }
      }
    },
    "bindings": {
      "type": "object",
      "additionalProperties": false,
      "required": ["sdk-php", "sdk-python", "sdk-rust"],
      "properties": {
        "sdk-php": {
          "$ref": "#/$defs/binding"
        },
        "sdk-python": {
          "$ref": "#/$defs/binding"
        },
        "sdk-rust": {
          "$ref": "#/$defs/binding"
        }
      }
    }
  },
  "$defs": {
    "sha256": {
      "type": "string",
      "pattern": "^[0-9a-f]{64}$"
    },
    "artifact": {
      "type": "object",
      "additionalProperties": false,
      "required": ["source", "distribution"],
      "properties": {
        "source": {
          "$ref": "#/$defs/sourceIdentity"
        },
        "distribution": {
          "$ref": "#/$defs/distributionIdentity"
        }
      }
    },
    "sourceIdentity": {
      "type": "object",
      "additionalProperties": false,
      "required": ["version", "commit"],
      "properties": {
        "version": {
          "type": "string",
          "minLength": 1
        },
        "commit": {
          "type": "string",
          "pattern": "^[0-9a-f]{40}$"
        }
      }
    },
    "distributionIdentity": {
      "type": "object",
      "additionalProperties": false,
      "required": ["kind", "locator", "artifacts"],
      "properties": {
        "kind": {
          "enum": ["composer", "pypi", "crates.io", "oci"]
        },
        "locator": {
          "type": "string",
          "minLength": 1
        },
        "artifacts": {
          "type": "array",
          "minItems": 1,
          "items": {
            "type": "object",
            "additionalProperties": false,
            "required": ["name", "sha256"],
            "properties": {
              "name": {
                "type": "string",
                "minLength": 1
              },
              "sha256": {
                "$ref": "#/$defs/sha256"
              }
            }
          }
        }
      }
    },
    "githubRun": {
      "type": "object",
      "additionalProperties": false,
      "required": ["repository", "run_id", "run_attempt", "evidence_tag"],
      "properties": {
        "repository": {
          "const": "durable-workflow/.github"
        },
        "run_id": {
          "type": "integer",
          "minimum": 1
        },
        "run_attempt": {
          "type": "integer",
          "minimum": 1
        },
        "evidence_tag": {
          "type": "string",
          "pattern": "^beta-conformance/"
        }
      }
    },
    "binding": {
      "type": "object",
      "additionalProperties": false,
      "required": [
        "sdk",
        "server",
        "supported_server_versions",
        "outcome",
        "experiments"
      ],
      "properties": {
        "sdk": {
          "$ref": "#/$defs/artifact"
        },
        "server": {
          "$ref": "#/$defs/artifact"
        },
        "supported_server_versions": {
          "type": "string",
          "minLength": 1
        },
        "outcome": {
          "enum": ["pass", "fail"]
        },
        "experiments": {
          "type": "array",
          "const": ["heartbeats", "replay", "signals-queries"]
        }
      }
    }
  }
}
