{
  "$schema": "./sdk-server-qualification-schema.json",
  "schema": "durable-workflow.sdk-server-qualification/v1",
  "release_plan": {
    "tag": "release-plan/current-2-0-20260801",
    "sha256": "d4f976b427939b50cd3ac590df3664d76d2b9a0018a86ce2fc16dcd528945ea8"
  },
  "outcome": "pass",
  "evidence": {
    "schema": "durable-workflow.beta-conformance.suite-result/v2",
    "tag": "beta-conformance/rc-current-2-0-20260801/30708509976.1",
    "source_url": "https://github.com/durable-workflow/.github/releases/download/beta-conformance/rc-current-2-0-20260801/30708509976.1/suite-result.json",
    "sha256": "ac78fbd51be97afdd1e307b7409d9c23f3d9eefdf7cae7890cae5eff5ba542c5",
    "outcome": "pass",
    "github_run": {
      "repository": "durable-workflow/.github",
      "run_id": 30708509976,
      "run_attempt": 1,
      "evidence_tag": "beta-conformance/rc-current-2-0-20260801/30708509976.1"
    }
  },
  "bindings": {
    "sdk-php": {
      "sdk": {
        "source": {
          "version": "2.0.0-rc.6",
          "commit": "31698e4b97fd36e56f05517a0bd56ec7e16a8c05"
        },
        "distribution": {
          "kind": "composer",
          "locator": "composer:durable-workflow/sdk@2.0.0-rc.6",
          "artifacts": [
            {
              "name": "durable-workflow/sdk",
              "sha256": "6aa7cae401fc30f5b81d4fcfbce7f3539c16afea3450fbef6a944d844fccdd81"
            }
          ]
        }
      },
      "server": {
        "source": {
          "version": "2.0.0-rc.13",
          "commit": "0f0ce78e8d4eadb91a34a0d09f67e04f5335cdea"
        },
        "distribution": {
          "kind": "oci",
          "locator": "oci:docker.io/durableworkflow/server@2.0.0-rc.13",
          "artifacts": [
            {
              "name": "manifest",
              "sha256": "e7d0402c74af6b918303d519b5034ad404f2cfd8f87c6a30e382039ed960dc4d"
            }
          ]
        }
      },
      "supported_server_versions": "2.0.0-rc.13",
      "outcome": "pass",
      "experiments": [
        "heartbeats",
        "replay",
        "signals-queries"
      ]
    },
    "sdk-python": {
      "sdk": {
        "source": {
          "version": "2.0.0-rc.8",
          "commit": "6c5ad457d98834f90799db093c8dff515bee710e"
        },
        "distribution": {
          "kind": "pypi",
          "locator": "pypi:durable-workflow@2.0.0rc8",
          "artifacts": [
            {
              "name": "durable_workflow-2.0.0rc8-py3-none-any.whl",
              "sha256": "fd6df596ad15f9ce1376d9475263f56edc66523fbd532c247e22162f6c1aa4b7"
            }
          ]
        }
      },
      "server": {
        "source": {
          "version": "2.0.0-rc.13",
          "commit": "0f0ce78e8d4eadb91a34a0d09f67e04f5335cdea"
        },
        "distribution": {
          "kind": "oci",
          "locator": "oci:docker.io/durableworkflow/server@2.0.0-rc.13",
          "artifacts": [
            {
              "name": "manifest",
              "sha256": "e7d0402c74af6b918303d519b5034ad404f2cfd8f87c6a30e382039ed960dc4d"
            }
          ]
        }
      },
      "supported_server_versions": "2.0.0-rc.13",
      "outcome": "pass",
      "experiments": [
        "heartbeats",
        "replay",
        "signals-queries"
      ]
    },
    "sdk-rust": {
      "sdk": {
        "source": {
          "version": "2.0.0-rc.7",
          "commit": "527dc8581131a40f127d1d8144a3b55d87829ac8"
        },
        "distribution": {
          "kind": "crates.io",
          "locator": "crates.io:durable-workflow@2.0.0-rc.7",
          "artifacts": [
            {
              "name": "durable-workflow-2.0.0-rc.7.crate",
              "sha256": "6c11fb91b4fe939471807188e62bc59c73ebae0fb51fddee73ea0022dd4a5e7e"
            }
          ]
        }
      },
      "server": {
        "source": {
          "version": "2.0.0-rc.13",
          "commit": "0f0ce78e8d4eadb91a34a0d09f67e04f5335cdea"
        },
        "distribution": {
          "kind": "oci",
          "locator": "oci:docker.io/durableworkflow/server@2.0.0-rc.13",
          "artifacts": [
            {
              "name": "manifest",
              "sha256": "e7d0402c74af6b918303d519b5034ad404f2cfd8f87c6a30e382039ed960dc4d"
            }
          ]
        }
      },
      "supported_server_versions": "2.0.0-rc.13",
      "outcome": "pass",
      "experiments": [
        "heartbeats",
        "replay",
        "signals-queries"
      ]
    }
  }
}
